date,content,platform,likes,shares
2023-01-15,I absolutely love the new features in the latest update! Great job team!,facebook,45,12
2023-01-16,This product completely changed my life for the better. Highly recommend!,facebook,87,30
2023-01-17,Customer service was helpful but slow to respond. Could be better.,facebook,12,2
2023-01-18,Having some issues with the app crashing. Please fix this soon.,facebook,8,4
2023-01-19,Not worth the price. Very disappointed with the quality.,facebook,5,3
2023-01-20,Neutral review. Works as expected. Nothing special but gets the job done.,facebook,15,0
2023-01-21,Can anyone help with setting up the new version? A bit confused.,facebook,9,1
2023-01-22,Amazing experience with this brand! Will definitely buy again.,facebook,67,22
2023-01-23,The waiting time for support is ridiculous. Terrible service.,facebook,3,5
2023-01-24,Just received my order and everything looks good. Packaging was nice.,facebook,24,2
2023-01-25,Perfect product for my needs. Exceeded expectations in every way!,facebook,77,18
2023-01-26,Somewhat satisfied but expected more features for the premium version.,facebook,19,0
2023-01-27,Finally a company that understands what users want. Great job!,facebook,56,14
2023-01-28,Really frustrated with this service. Waste of money and time.,facebook,4,7
2023-01-29,Standard quality. Neither impressed nor disappointed.,facebook,11,1
2023-01-30,The community around this product is so supportive. Love it!,facebook,42,8
